{
  "schema_version": "1.0.0",
  "artifact_kind": "aaa_video_curation_audit_report",
  "status": "candidate_applied_not_verified",
  "audit_date": "2026-06-15",
  "scope": "Minimal audit report example.",
  "runner_status": {
    "local_command_execution": "blocked_by_environment_CreateProcessAsUserW_failed_5",
    "validated_by_runner": false,
    "commit_created": false,
    "push_completed": false
  },
  "release_status": {
    "ready_for_aaa": false,
    "ready_for_rom_delivery": false,
    "reason": "Minimal example has no local validation or emulator evidence."
  },
  "required_next_steps": [
    "Run validator locally."
  ]
}
